/* First test whether a table's replication set can be properly manipulated */
\c postgres
CREATE SCHEMA normalschema;
CREATE SCHEMA "strange.schema-IS";
CREATE TABLE switcheroo(id serial primary key, data text);
CREATE TABLE normalschema.sometbl_normalschema();
CREATE TABLE "strange.schema-IS".sometbl_strangeschema();
-- show initial replication sets
SELECT * FROM bdr.table_get_replication_sets('switcheroo');
     sets      
---------------
 {default,all}
(1 row)

SELECT pg_xlog_wait_remote_apply(pg_current_xlog_location(), pid) FROM pg_stat_replication;
 pg_xlog_wait_remote_apply 
---------------------------
 
 
(2 rows)

\c regression
SELECT * FROM bdr.table_get_replication_sets('switcheroo');
     sets      
---------------
 {default,all}
(1 row)

\c postgres
-- empty replication set (just 'all')
SELECT bdr.table_set_replication_sets('switcheroo', '{}');
 table_set_replication_sets 
----------------------------
 
(1 row)

SELECT * FROM bdr.table_get_replication_sets('switcheroo');
 sets  
-------
 {all}
(1 row)

SELECT * FROM bdr.table_get_replication_sets('normalschema.sometbl_normalschema');
     sets      
---------------
 {default,all}
(1 row)

SELECT * FROM bdr.table_get_replication_sets('"strange.schema-IS".sometbl_strangeschema');
     sets      
---------------
 {default,all}
(1 row)

-- configure a couple
SELECT bdr.table_set_replication_sets('switcheroo', '{fascinating, is-it-not}');
 table_set_replication_sets 
----------------------------
 
(1 row)

SELECT * FROM bdr.table_set_replication_sets('normalschema.sometbl_normalschema', '{a}');
 table_set_replication_sets 
----------------------------
 
(1 row)

SELECT * FROM bdr.table_set_replication_sets('"strange.schema-IS".sometbl_strangeschema', '{a}');
 table_set_replication_sets 
----------------------------
 
(1 row)

SELECT * FROM bdr.table_get_replication_sets('switcheroo');
            sets             
-----------------------------
 {fascinating,is-it-not,all}
(1 row)

SELECT * FROM bdr.table_get_replication_sets('normalschema.sometbl_normalschema');
  sets   
---------
 {a,all}
(1 row)

SELECT * FROM bdr.table_get_replication_sets('"strange.schema-IS".sometbl_strangeschema');
  sets   
---------
 {a,all}
(1 row)

SELECT pg_xlog_wait_remote_apply(pg_current_xlog_location(), pid) FROM pg_stat_replication;
 pg_xlog_wait_remote_apply 
---------------------------
 
 
(2 rows)

\c regression
SELECT * FROM bdr.table_get_replication_sets('switcheroo');
            sets             
-----------------------------
 {fascinating,is-it-not,all}
(1 row)

SELECT * FROM bdr.table_get_replication_sets('normalschema.sometbl_normalschema');
  sets   
---------
 {a,all}
(1 row)

SELECT * FROM bdr.table_get_replication_sets('"strange.schema-IS".sometbl_strangeschema');
  sets   
---------
 {a,all}
(1 row)

\c postgres
-- make sure we can reset replication sets to the default again
-- configure a couple
SELECT bdr.table_set_replication_sets('switcheroo', NULL);
 table_set_replication_sets 
----------------------------
 
(1 row)

SELECT * FROM bdr.table_get_replication_sets('switcheroo');
     sets      
---------------
 {default,all}
(1 row)

SELECT pg_xlog_wait_remote_apply(pg_current_xlog_location(), pid) FROM pg_stat_replication;
 pg_xlog_wait_remote_apply 
---------------------------
 
 
(2 rows)

\c regression
SELECT * FROM bdr.table_get_replication_sets('switcheroo');
     sets      
---------------
 {default,all}
(1 row)

\c postgres
-- make sure reserved names can't be set
SELECT bdr.table_set_replication_sets('switcheroo', '{default,blubber}');
ERROR:  replication set name "default" is reserved
CONTEXT:  SQL statement "SECURITY LABEL FOR bdr ON TABLE switcheroo IS '{ "sets" : ["default","blubber"] }'"
PL/pgSQL function bdr.table_set_replication_sets(regclass,text[]) line 30 at EXECUTE statement
SELECT bdr.table_set_replication_sets('switcheroo', '{blubber,default}');
ERROR:  replication set name "default" is reserved
CONTEXT:  SQL statement "SECURITY LABEL FOR bdr ON TABLE switcheroo IS '{ "sets" : ["blubber","default"] }'"
PL/pgSQL function bdr.table_set_replication_sets(regclass,text[]) line 30 at EXECUTE statement
SELECT bdr.table_set_replication_sets('switcheroo', '{frakbar,all}');
ERROR:  replication set name "all" is reserved
CONTEXT:  SQL statement "SECURITY LABEL FOR bdr ON TABLE switcheroo IS '{ "sets" : ["frakbar","all"] }'"
PL/pgSQL function bdr.table_set_replication_sets(regclass,text[]) line 30 at EXECUTE statement
--invalid characters
SELECT bdr.table_set_replication_sets('switcheroo', '{///}');
ERROR:  replication set name "///" contains invalid character
HINT:  Replication set names may only contain letters, numbers, and the underscore character.
CONTEXT:  SQL statement "SECURITY LABEL FOR bdr ON TABLE switcheroo IS '{ "sets" : ["///"] }'"
PL/pgSQL function bdr.table_set_replication_sets(regclass,text[]) line 30 at EXECUTE statement
--too short/long
SELECT bdr.table_set_replication_sets('switcheroo', '{""}');
ERROR:  replication set name "" is too short
CONTEXT:  SQL statement "SECURITY LABEL FOR bdr ON TABLE switcheroo IS '{ "sets" : [""] }'"
PL/pgSQL function bdr.table_set_replication_sets(regclass,text[]) line 30 at EXECUTE statement
SELECT bdr.table_set_replication_sets('switcheroo', '{12345678901234567890123456789012345678901234567890123456789012345678901234567890}');
ERROR:  replication set name "12345678901234567890123456789012345678901234567890123456789012345678901234567890" is too long
CONTEXT:  SQL statement "SECURITY LABEL FOR bdr ON TABLE switcheroo IS '{ "sets" : ["12345678901234567890123456789012345678901234567890123456789012345678901234567890"] }'"
PL/pgSQL function bdr.table_set_replication_sets(regclass,text[]) line 30 at EXECUTE statement
\c postgres
DROP TABLE switcheroo;
DROP TABLE normalschema.sometbl_normalschema;
DROP TABLE "strange.schema-IS".sometbl_strangeschema;
SELECT pg_xlog_wait_remote_apply(pg_current_xlog_location(), pid) FROM pg_stat_replication;
 pg_xlog_wait_remote_apply 
---------------------------
 
 
(2 rows)

/*
 * Now test whether sets properly control the replication of data.
 *
 * node1: dbname regression, sets: default, important, for-node-1
 * node2: dbname postgres, sets: default, important, for-node-2
 */
\c postgres
CREATE TABLE settest_1(data text primary key);
INSERT INTO settest_1(data) VALUES ('should-replicate-via-default');
SELECT bdr.table_set_replication_sets('settest_1', '{}');
 table_set_replication_sets 
----------------------------
 
(1 row)

INSERT INTO settest_1(data) VALUES ('should-no-replicate-no-sets');
SELECT bdr.table_set_replication_sets('settest_1', '{unknown-set}');
 table_set_replication_sets 
----------------------------
 
(1 row)

INSERT INTO settest_1(data) VALUES ('should-no-replicate-unknown-set');
SELECT bdr.table_set_replication_sets('settest_1', '{for-node-2}');
 table_set_replication_sets 
----------------------------
 
(1 row)

INSERT INTO settest_1(data) VALUES ('should-replicate-via-for-node-2');
SELECT bdr.table_set_replication_sets('settest_1', '{}');
 table_set_replication_sets 
----------------------------
 
(1 row)

INSERT INTO settest_1(data) VALUES ('should-not-replicate-empty-again');
SELECT bdr.table_set_replication_sets('settest_1', '{unknown-set,for-node-2}');
 table_set_replication_sets 
----------------------------
 
(1 row)

INSERT INTO settest_1(data) VALUES ('should-replicate-via-for-node-2-even-though-unknown');
SELECT bdr.table_set_replication_sets('settest_1', '{unknown-set,important,for-node-2}');
 table_set_replication_sets 
----------------------------
 
(1 row)

INSERT INTO settest_1(data) VALUES ('should-replicate-via-for-node-2-and-important');
SELECT * FROM settest_1 ORDER BY data;
                        data                         
-----------------------------------------------------
 should-no-replicate-no-sets
 should-no-replicate-unknown-set
 should-not-replicate-empty-again
 should-replicate-via-default
 should-replicate-via-for-node-2
 should-replicate-via-for-node-2-and-important
 should-replicate-via-for-node-2-even-though-unknown
(7 rows)

SELECT pg_xlog_wait_remote_apply(pg_current_xlog_location(), pid) FROM pg_stat_replication;
 pg_xlog_wait_remote_apply 
---------------------------
 
 
(2 rows)

\c regression
SELECT * FROM settest_1 ORDER BY data;
                        data                         
-----------------------------------------------------
 should-replicate-via-default
 should-replicate-via-for-node-2
 should-replicate-via-for-node-2-and-important
 should-replicate-via-for-node-2-even-though-unknown
(4 rows)

\c postgres
DROP TABLE settest_1;
/*
 * Now test configurations where only some actions are replicated.
 */
CREATE TABLE settest_2(data text primary key);
-- Test 1: ensure that inserts are replicated while update/delete are filtered
SELECT bdr.table_set_replication_sets('settest_2', '{for-node-2-insert}');
 table_set_replication_sets 
----------------------------
 
(1 row)

INSERT INTO bdr.bdr_replication_set_config(set_name, replicate_inserts, replicate_updates, replicate_deletes)
VALUES ('for-node-2-insert', true, false, false),
       ('for-node-2-update', false, true, false),
       ('for-node-2-delete', false, false, true);
INSERT INTO settest_2(data) VALUES ('repl-insert--insert-#1');
INSERT INTO settest_2(data) VALUES ('repl-insert--insert-#2-then-update');
INSERT INTO settest_2(data) VALUES ('repl-insert--insert-#3-then-delete');
UPDATE settest_2
SET data = 'repl-insert--insert-#2-update'
WHERE data = 'repl-insert--insert-#2-then-update';
DELETE FROM settest_2
WHERE data = 'repl-insert--insert-#3-then-delete';
-- Test 2: ensure that updates are replicated while inserts/deletes are filtered
-- insert before filtering
INSERT INTO settest_2(data) VALUES ('repl-update--insert-#1-then-update');
INSERT INTO settest_2(data) VALUES ('repl-update--insert-#2-then-delete');
SELECT bdr.table_set_replication_sets('settest_2', '{for-node-2-update}');
 table_set_replication_sets 
----------------------------
 
(1 row)

UPDATE settest_2
SET data = 'repl-update--insert-#1-update'
WHERE data = 'repl-update--insert-#1-then-update';
DELETE FROM settest_2
WHERE data = 'repl-update--insert-#2-then-delete';
INSERT INTO settest_2(data) VALUES ('repl-update--insert-#3');
-- verify that changing the pg_replication_sets row has effects
UPDATE bdr.bdr_replication_set_config
SET replicate_inserts = true
WHERE set_name = 'for-node-2-update';
INSERT INTO settest_2(data) VALUES ('repl-update--insert-#4');
-- but reset to normal meaning afterwards
UPDATE bdr.bdr_replication_set_config
SET replicate_inserts = false
WHERE set_name = 'for-node-2-update';
-- Test 3: ensure that deletes are replicated while inserts/updates are filtered
-- insert before filtering
SELECT bdr.table_set_replication_sets('settest_2', NULL);
 table_set_replication_sets 
----------------------------
 
(1 row)

INSERT INTO settest_2(data) VALUES ('repl-delete--insert-#1-then-update');
INSERT INTO settest_2(data) VALUES ('repl-delete--insert-#2-then-delete');
SELECT bdr.table_set_replication_sets('settest_2', '{for-node-2-delete}');
 table_set_replication_sets 
----------------------------
 
(1 row)

UPDATE settest_2
SET data = 'repl-delete--insert-#1-update'
WHERE data = 'repl-delete--insert-#1-then-update';
DELETE FROM settest_2
WHERE data = 'repl-delete--insert-#2-then-delete';
INSERT INTO settest_2(data) VALUES ('repl-delete--insert-#3');
-- Test 4: ensure that all partial sets together replicate everything
SELECT bdr.table_set_replication_sets('settest_2',
    '{for-node-2-insert,for-node-2-update,for-node-2-delete}');
 table_set_replication_sets 
----------------------------
 
(1 row)

INSERT INTO settest_2(data) VALUES ('repl-combined--insert-#1-then-update');
INSERT INTO settest_2(data) VALUES ('repl-combined--insert-#2-then-delete');
UPDATE settest_2
SET data = 'repl-combined--insert-#1-update'
WHERE data = 'repl-combined--insert-#1-then-update';
DELETE FROM settest_2
WHERE data = 'repl-combined--insert-#2-then-delete';
SELECT * FROM settest_2 ORDER BY data;
              data               
---------------------------------
 repl-combined--insert-#1-update
 repl-delete--insert-#1-update
 repl-delete--insert-#3
 repl-insert--insert-#1
 repl-insert--insert-#2-update
 repl-update--insert-#1-update
 repl-update--insert-#3
 repl-update--insert-#4
(8 rows)

SELECT pg_xlog_wait_remote_apply(pg_current_xlog_location(), pid) FROM pg_stat_replication;
 pg_xlog_wait_remote_apply 
---------------------------
 
 
(2 rows)

\c regression
SELECT * FROM settest_2 ORDER BY data;
                data                
------------------------------------
 repl-combined--insert-#1-update
 repl-delete--insert-#1-then-update
 repl-insert--insert-#1
 repl-insert--insert-#2-then-update
 repl-insert--insert-#3-then-delete
 repl-update--insert-#1-update
 repl-update--insert-#2-then-delete
 repl-update--insert-#4
(8 rows)

