SELECT * FROM bdr_regress_variables()
\gset
\set VERBOSITY terse
\c :node1_dsn
CREATE EXTENSION bdr CASCADE;
NOTICE:  installing required extension "pglogical"
SELECT E'\'' || current_database() || E'\'' AS node1_db
\gset
\c :node2_dsn
CREATE EXTENSION bdr CASCADE;
NOTICE:  installing required extension "pglogical"
SELECT E'\'' || current_database() || E'\'' AS node2_db
\gset
\c :node1_dsn
-- Only used in tests
CREATE FUNCTION bdr_submit_comment(message text)
RETURNS text LANGUAGE c STRICT AS 'bdr','bdr_submit_comment';
-- We should be doing a bdr node create/join here but we don't yet have the
-- interfaces for that. We're just dummied up so far. So create a pglogical
-- node, and let that bring up BDR because the BDR plugin is loaded, even
-- though no actual BDR node is created yet.
SELECT 1
FROM pglogical.create_node(node_name := 'node1', dsn := :'node1_dsn' || ' user=super');
 ?column? 
----------
        1
(1 row)

CREATE FUNCTION
pglogical_wait_slot_confirm_lsn(slotname name, target pg_lsn)
RETURNS void LANGUAGE c AS 'pglogical','pglogical_wait_slot_confirm_lsn';
-- BDR would usually auto-create this but it doesn't know how
-- yet, so do it manually
SELECT 1 FROM pglogical.create_replication_set('dummy_nodegroup');
 ?column? 
----------
        1
(1 row)

-- Create the BDR node
--
-- Doing it in this order is racey since pglogical will start the manager before
-- we can reliably create the bdr node entries. We'll have to restart pglogical
-- with pg_terminate_backend afterwards.
INSERT INTO bdr.node_group(node_group_id, node_group_name)
VALUES (4, 'dummy_nodegroup');
INSERT INTO bdr.node(pglogical_node_id, node_group_id)
SELECT node_id, 4 FROM pglogical.local_node;
-- We must create a slot before creating the subscription to work
-- around the deadlock in 2ndQuadrant/pglogical_internal#152
SELECT slot_name FROM pg_create_logical_replication_slot(pglogical.pglogical_gen_slot_name(:node2_db, 'node1', 'bdr'), 'pglogical');
       slot_name        
------------------------
 pgl_postgres_node1_bdr
(1 row)

\c :node2_dsn
-- Manually create a second node
SELECT 1
FROM pglogical.create_node(node_name := 'node2', dsn := :'node2_dsn' || ' user=super');
 ?column? 
----------
        1
(1 row)

INSERT INTO bdr.node_group(node_group_id, node_group_name)
VALUES (4, 'dummy_nodegroup');
INSERT INTO bdr.node(pglogical_node_id, node_group_id)
SELECT node_id, 4 FROM pglogical.local_node;
-- Subscribe to the first node
-- See GH#152 for why we don't create the slot
SELECT 1 FROM pglogical.create_subscription(
    subscription_name := 'bdr',
    provider_dsn := ( :'node1_dsn' || ' user=super' ),
    synchronize_structure := true,
    forward_origins := '{}',
    replication_sets := ARRAY['dummy_nodegroup','ddl_sql'],
	create_slot := false);
 ?column? 
----------
        1
(1 row)

-- and set the subscription as 'isinternal' so BDR thinks BDR owns it.
UPDATE pglogical.subscription SET sub_isinternal = true;
-- BDR would usually auto-create this but it doesn't know how
-- yet, so do it manually
SELECT 1 FROM pglogical.create_replication_set('dummy_nodegroup');
 ?column? 
----------
        1
(1 row)

-- Wait for the initial copy to finish
--
-- If we don't do this, we'll usually kill the apply worker during init
-- and it won't retry since it doesn't know if the restore was partial
-- last time around
DO LANGUAGE plpgsql $$
BEGIN
  WHILE (SELECT status <> 'replicating' FROM pglogical.show_subscription_status())
  LOOP
    PERFORM pg_sleep(0.5);
  END LOOP;
END;
$$;
SELECT subscription_name, status, provider_node, slot_name, replication_sets
FROM pglogical.show_subscription_status();
 subscription_name |   status    | provider_node |       slot_name        |     replication_sets      
-------------------+-------------+---------------+------------------------+---------------------------
 bdr               | replicating | node1         | pgl_postgres_node1_bdr | {dummy_nodegroup,ddl_sql}
(1 row)

-- See above...
SELECT slot_name FROM pg_create_logical_replication_slot(pglogical.pglogical_gen_slot_name(:node1_db, 'node2', 'bdr'), 'pglogical');
        slot_name         
--------------------------
 pgl_regression_node2_bdr
(1 row)

\c :node1_dsn
-- Subscribe to the second node and make the subscription 'internal'
-- but this time don't sync structure.
--
-- See GH#152 for why we don't create the slot
SELECT 1 FROM pglogical.create_subscription(
    subscription_name := 'bdr',
    provider_dsn := ( :'node2_dsn' || ' user=super' ),
    synchronize_structure := false,
    forward_origins := '{}',
    replication_sets := ARRAY['dummy_nodegroup','ddl_sql'],
    create_slot := false);
 ?column? 
----------
        1
(1 row)

UPDATE pglogical.subscription SET sub_isinternal = true;
DO LANGUAGE plpgsql $$
BEGIN
  WHILE (SELECT status <> 'replicating' FROM pglogical.show_subscription_status())
  LOOP
    PERFORM pg_sleep(0.5);
  END LOOP;
END;
$$;
SELECT subscription_name, status, provider_node, slot_name, replication_sets
FROM pglogical.show_subscription_status();
 subscription_name |   status    | provider_node |        slot_name         |     replication_sets      
-------------------+-------------+---------------+--------------------------+---------------------------
 bdr               | replicating | node2         | pgl_regression_node2_bdr | {dummy_nodegroup,ddl_sql}
(1 row)

-- Now, since BDR doesn't know we changed any catalogs etc,
-- restart pglogical to make the plugin re-read its config
SET client_min_messages = error;
CREATE TEMPORARY TABLE throwaway AS
SELECT pg_terminate_backend(pid)
FROM pg_stat_activity
WHERE pid <> pg_backend_pid();
DROP TABLE throwaway;
SET client_min_messages = notice;
-- Wait for it to start up
-- We already created the slots so all we have to do here is wait for
-- the slots to be in sync once we do some WAL-logged work on the
-- upstreams.
CREATE TABLE throwaway AS SELECT 1;
\c :node2_dsn
CREATE TABLE throwaway AS SELECT 1;
\c :node1_dsn
SELECT pglogical_wait_slot_confirm_lsn(NULL, NULL);
 pglogical_wait_slot_confirm_lsn 
---------------------------------
 
(1 row)

SELECT application_name, sync_state
FROM pg_stat_replication
ORDER BY application_name;
 application_name | sync_state 
------------------+------------
 bdr              | async
 bdr              | async
(2 rows)

SELECT slot_name, plugin, slot_type, database, temporary, active
FROM pg_replication_slots ORDER BY slot_name;
        slot_name         |  plugin   | slot_type |  database  | temporary | active 
--------------------------+-----------+-----------+------------+-----------+--------
 pgl_postgres_node1_bdr   | pglogical | logical   | regression | f         | t
 pgl_regression_node2_bdr | pglogical | logical   | postgres   | f         | t
(2 rows)

SELECT
    backend_type,
    regexp_replace(application_name, '[[:digit:]]', 'n', 'g') AS appname
FROM pg_stat_activity
WHERE application_name LIKE 'pglogical%';
   backend_type    |               appname               
-------------------+-------------------------------------
 background worker | pglogical supervisor
 background worker | pglogical manager nnnnn
 background worker | pglogical receiver nnnnn:nnnnnnnnnn
 background worker | pglogical manager nnnnn
 background worker | pglogical receiver nnnnn:nnnnnnnnnn
(5 rows)

