\c postgres
SELECT bdr.bdr_replicate_ddl_command($$
        CREATE TABLE public.test_read_only (
                data text
        );
$$);
 bdr_replicate_ddl_command 
---------------------------
 
(1 row)

-- set all nodes ro
SELECT bdr.bdr_node_set_read_only(node_name, true) FROM bdr.bdr_nodes;
 bdr_node_set_read_only 
------------------------
 
 
(2 rows)

SELECT pg_xlog_wait_remote_apply(pg_current_xlog_location(), pid) FROM pg_stat_replication;
 pg_xlog_wait_remote_apply 
---------------------------
 
 
(2 rows)

-- errors
CREATE TABLE test(a int);
ERROR:  Cannot run CREATE TABLE on read-only BDR node.
SELECT bdr.bdr_replicate_ddl_command($$
        CREATE TABLE public.test (
                data text
        );
$$);
ERROR:  Cannot run CREATE TABLE on read-only BDR node.
CONTEXT:  during DDL replay of ddl statement: 
        CREATE TABLE public.test (
                data text
        );

INSERT INTO public.test_read_only VALUES('foo');
ERROR:  INSERT may only affect UNLOGGED or TEMPORARY tables on read-only BDR node; test_read_only is a regular table
UPDATE public.test_read_only SET data = 'foo';
ERROR:  UPDATE may only affect UNLOGGED or TEMPORARY tables on read-only BDR node; test_read_only is a regular table
DELETE FROM public.test_read_only;
ERROR:  DELETE may only affect UNLOGGED or TEMPORARY tables on read-only BDR node; test_read_only is a regular table
WITH cte AS (
	INSERT INTO public.test_read_only VALUES('foo') RETURNING *
)
SELECT * FROM cte;
ERROR:  DML may only affect UNLOGGED or TEMPORARY tables on read-only BDR node; test_read_only is a regular table
-- success
CREATE TEMP TABLE test_read_only_temp (
        data text
);
INSERT INTO test_read_only_temp VALUES('foo');
UPDATE test_read_only_temp SET data = 'foo';
DELETE FROM test_read_only_temp;
WITH cte AS (
	INSERT INTO test_read_only_temp VALUES('foo') RETURNING *
)
SELECT * FROM cte;
 data 
------
 foo
(1 row)

\c regression
-- errors
CREATE TABLE test(a int);
ERROR:  Cannot run CREATE TABLE on read-only BDR node.
SELECT bdr.bdr_replicate_ddl_command($$
        CREATE TABLE public.test (
                data text
        );
$$);
ERROR:  Cannot run CREATE TABLE on read-only BDR node.
CONTEXT:  during DDL replay of ddl statement: 
        CREATE TABLE public.test (
                data text
        );

INSERT INTO public.test_read_only VALUES('foo');
ERROR:  INSERT may only affect UNLOGGED or TEMPORARY tables on read-only BDR node; test_read_only is a regular table
UPDATE public.test_read_only SET data = 'foo';
ERROR:  UPDATE may only affect UNLOGGED or TEMPORARY tables on read-only BDR node; test_read_only is a regular table
DELETE FROM public.test_read_only;
ERROR:  DELETE may only affect UNLOGGED or TEMPORARY tables on read-only BDR node; test_read_only is a regular table
WITH cte AS (
	INSERT INTO public.test_read_only VALUES('foo') RETURNING *
)
SELECT * FROM cte;
ERROR:  DML may only affect UNLOGGED or TEMPORARY tables on read-only BDR node; test_read_only is a regular table
-- success
CREATE TEMP TABLE test_read_only_temp (
        data text
);
INSERT INTO test_read_only_temp VALUES('foo');
UPDATE test_read_only_temp SET data = 'foo';
DELETE FROM test_read_only_temp;
WITH cte AS (
	INSERT INTO test_read_only_temp VALUES('foo') RETURNING *
)
SELECT * FROM cte;
 data 
------
 foo
(1 row)

\c postgres
-- set all nodes rw
SELECT bdr.bdr_node_set_read_only(node_name, false) FROM bdr.bdr_nodes;
 bdr_node_set_read_only 
------------------------
 
 
(2 rows)

SELECT pg_xlog_wait_remote_apply(pg_current_xlog_location(), pid) FROM pg_stat_replication;
 pg_xlog_wait_remote_apply 
---------------------------
 
 
(2 rows)

-- cleanup
SELECT bdr.bdr_replicate_ddl_command($$
        DROP TABLE public.test_read_only;
$$);
 bdr_replicate_ddl_command 
---------------------------
 
(1 row)

